Title,Organization,Location,Salary,Starting Date,Published Date,Tags
R0065806 Program Technician - Forages,University of Arkansas Cooperative Extension Service (State),"2301 S University Avenue (Little Rock, Arkansas)",Commensurate / Negotiable,after 2/24/2025,01/23/2025,N/A
"Ph.D. and M.S. Opportunities, Fisheries Ecology Lab",Dauphin Island Sea Lab (State),multiple,"$21,600 to $24,600 per year",after 8/1/2025,01/17/2025,Graduate Opportunities
Funded Ph.D. Opportunity on Salt Marsh Migration Research,"Graduate School of Oceanography, University of Rhode Island (State)","Graduate School of Oceanography (Narragansett, Rhode Island)",Commensurate / Negotiable,after 9/1/2025,12/17/2024,Graduate Opportunities
Continuing Education - Master's degrees for Natural Resources Professionals,Frostburg State University (State),"Frostburg State University (Frostburg, Maryland)","starting at $2,500 per year",between 8/11/2025 and 8/25/2025,01/17/2025,Graduate Opportunities
Now Accepting Applications! Master of Wildlife and Fisheries Resources Program,Clemson University (State),remote work allowed,none,after 1/1/2025,11/20/2024,Graduate Opportunities
Master Naturalist,Swan Valley Connections (Private),"Condon, Montana",none,after 8/16/2025,11/12/2024,"Graduate Opportunities, Undergraduate Opportunities"
Master of Science in Integrative Biology,Kennesaw State University (State),"Kennesaw State University (Kennesaw, Georgia)","starting at $1,650 per month",after 8/1/2025,01/29/2025,Graduate Opportunities
Biology Master of Science Graduate Student Wanted!,The University of Texas at Tyler (State),"3900 University Blvd. (Tyler, Texas)","starting at $21,000 per year",after 8/11/2025,01/24/2025,Graduate Opportunities
Take Action: Final Call for MS in Environmental Conservation Applications!,"University of Wisconsin-Madison, Nelson Institute for Environmental Studies (State)","Madison, Wisconsin",Commensurate / Negotiable,after 6/2/2025,01/21/2025,Graduate Opportunities
Graduate Research Assistant (Masters) - Bat Ecology,State University of New York College of Environmental Science and Forestry (State),"SUNY ESF (Syracuse, New York)",Commensurate / Negotiable,after 6/1/2025,01/13/2025,Graduate Opportunities
Masters student opportunity in cattle set stocking experiment,Lakehead University (State),"Lakehead University (Thunder Bay, Canada)","starting at $2,000 per month",after 5/5/2025,01/10/2025,Graduate Opportunities
North Carolina Zoo's Animal Behavior and Welfare Research Internship: Summer Term,North Carolina Zoo (State),"4401 Zoo Parkway (Asheboro, North Carolina)",$100 per week,between 5/19/2025 and 5/27/2025,01/06/2025,"Graduate Opportunities, Undergraduate Opportunities"
Paid masters student position in pollinator behavior/ecology at ETSU,East Tennessee State University (State),"Johnson City, Tennessee","starting at $9,000 per year",after 8/25/2025,01/01/2025,Graduate Opportunities
Conservation Social Science Graduate Assistantship,University of Wisconsin-Stevens Point (State),"Stevens Point , Wisconsin","$20,000 per year",after 9/1/2025,12/17/2024,Graduate Opportunities
Scholarships for Graduate Program in Environmental Education,Merry Lea Environmental Learning Center of Goshen College (Private),"2388 S. 500 W. (Albion, Indiana)",none,after 7/1/2025,12/11/2024,Graduate Opportunities
Masters of Science in Environmental Science,Bemidji State University (State),"1500 Birchmont Dr NE (Bemidji, Minnesota)","$20,000 per year",between 4/1/2025 and 6/1/2025,11/20/2024,Graduate Opportunities
Western Washington University Graduate Student Teaching Assistant,Western Washington University (State),"525 High Street (Bellingham, Washington)",Commensurate / Negotiable,between 9/1/2025 and 9/30/2025,11/11/2024,Graduate Opportunities
Paid Master’s training opportunity at Tennessee Technological University,Tennessee Technological University (State),"Tennessee Technological University (Cookeville, Tennessee)","up to $34,000 per year",after 7/1/2025,11/11/2024,Graduate Opportunities
Environmental Education and Science Communication Fellows - Masters Degree,University of Idaho - McCall Outdoor Science School (State),"1800 University Lane (McCall, Idaho)",none,between 8/12/2025 and 8/13/2025,11/08/2024,Graduate Opportunities
UCI Masters in Conservation and Restoration Science Program,University of California Irvine (State),"Irvine, California",none,after 9/22/2025,11/06/2024,N/A
Master in Environmental Management Degree,Western Colorado University (State),"Gunnison, Colorado | remote work allowed",none,after 6/1/2025,10/01/2024,Graduate Opportunities
Masters of Natural Resources – Environmental Education and Science Communication,University of Idaho - McCall Outdoor Science School (State),"McCall, Idaho",none,between 8/12/2025 and 8/13/2025,09/10/2024,Graduate Opportunities
Fully funded PhD students in biology available at Texas Christian University,Texas Christian University (Private),"Texas Christian University (Fort Worth , Texas)","starting at $27,500 per year",after 8/14/2025,01/29/2025,Graduate Opportunities
PhD Assistantship - Wintering Waterfowl Ecology,Tennessee Technological University (State),"Cookeville, Tennessee","starting at $37,000 per year",after 8/1/2025,01/28/2025,Graduate Opportunities
Graduate Assistantship in Amphibian Ecology and Conservation,University of Wyoming (State),"Laramie, Wyoming",Commensurate / Negotiable,between 8/17/2025 and 8/18/2025,01/27/2025,Graduate Opportunities
PhD Student opportunity in Texas tortoise ecology and conservation at Texas A&M University-Corpus Christi,Texas A&M University-Corpus Christi (State),"6300 Ocean Drive, Unit 5800 (Corpus Christi, Texas)",Commensurate / Negotiable,8/18/2025,01/24/2025,Graduate Opportunities
"Three Ph.D. Graduate Assistantships; College of Forestry, Wildlife and Environment at Auburn University",Steury Lab at Auburn University (State),"Auburn, Alabama","starting at $25,750 per year",after 8/1/2025,01/24/2025,Graduate Opportunities
Grassland Wildlife PhD (North Dakota State University),North Dakota State University (State),"Fargo, North Dakota","starting at $25,000 per year",between 4/1/2025 and 5/16/2025,01/23/2025,Graduate Opportunities
Graduate Research Assistant,Univeristy of Wyoming Jay Kemmerer WORTH Institute (State),"Laramie, Wyoming","starting at $35,884.27 per year",after 8/18/2025,01/21/2025,Graduate Opportunities
Two graduate assistantships (one MS and one PhD) – Distribution and population ecology of muskrat,Southern Illinois University (State),"1125 Lincoln Dr (Carbondale, Illinois)","$25,000 per year",8/4/2025,01/21/2025,Graduate Opportunities
MS or PhD assistantship – Evaluation of novel approaches for assessing white-tailed deer density,Southern Illinois University (State),"1125 Lincoln Dr (Carbondale, Illinois)","$25,000 per year",8/4/2025,01/21/2025,Graduate Opportunities
RESEARCH ASSISTANSHIP OPPORTUNITY (FALL 2025) – MS OR PhD,Texas Tech University (Federal),"Box 42125 (Lubbock, Texas)","$18,000 to $22,000 per year",after 9/1/2025,01/17/2025,"Graduate Opportunities, Undergraduate Opportunities"
Graduate Assistantships: Mussel Ecology – Texas A&M University,Texas A&M (State),"17360 Coit Road Dallas, Texas 75252 (Dallas, Texas)","$32,000 to $35,000 per year",before 8/1/2025,01/17/2025,Graduate Opportunities
PhD Research Assistant Position in Forest Ecosystem Health and Resilience Oklahoma State University,Oklahoma State University (State),"Oklahoma State University (Stillwater, Oklahoma)","$26,000 per year",between 5/12/2025 and 8/11/2025,01/17/2025,Graduate Opportunities
PhD student position (Ecology of reintroduced Texas horned lizards),Texas Christian University (Private),"Texas Christian University (Fort Worth, Texas, Texas)","$27,500 to $30,000 per year",after 8/18/2025,01/17/2025,Graduate Opportunities
"Graduate Teaching Assistantship - Fisheries, Wildlife, and Conservation Biology",North Carolina State University (State),"North Carolina State University (Raleigh, NC 27695, Texas)","$15,000 per year",between 8/1/2025 and 8/16/2025,01/17/2025,Graduate Opportunities
PhD opportunity: Noninvasive ecology of Golden Eagles with the Hopi Tribe,Northern Arizona University (State),"Northern Arizona University (Flagstaff, Arizona)","$27,433 per year",after 8/20/2025,01/17/2025,Graduate Opportunities
PhD Student Position at University of Florida: ABE Pathfinder Fellowship – Fall 2025,Dengjun Wang (Private),"1741 Museum Rd (Gainesville, Florida)","starting at $30,000 per year",after 8/4/2025,01/14/2025,Graduate Opportunities
Graduate Research Assistantship in Urban Entomology,University of Kentucky (State),"1100 S. Limestone (Lexington, Kentucky)","$27,000 per year",between 3/1/2025 and 8/1/2025,01/13/2025,Graduate Opportunities
PhD Assistantship in Forest Ecology,NC State University (State),"Raleigh, North Carolina","starting at $28,000 per year",between 5/15/2025 and 8/1/2025,01/13/2025,Graduate Opportunities
PhD position: Quantifying the cost of migration across a life history gradient in birds,University of Saskatchewan (Federal),"Saskatoon, Canada","starting at $35,000 per year",after 9/1/2025,01/10/2025,Graduate Opportunities
"Graduate Student Research Fellowship, Rocky Mountain National Park",National Park Service (Federal),"9847+CP Estes Park, CO, USA (Estes Park, Colorado)","$12,000 per year",after 5/1/2025,01/10/2025,"Graduate Opportunities, Grant"
Graduate Assistant,Gulf Coast Research Laboratory (State),"703 E BEACH DR (OCEAN SPRINGS, Mississippi)","$22,800 to $24,000 per year",after 6/1/2025,01/10/2025,Graduate Opportunities
PhD Assistantship – Predictive modeling and mapping of bat hibernacula across Maine,University of Maine (State),"Orono, Maine","$32,000 per year",after 9/1/2025,01/09/2025,Graduate Opportunities
Graduate Research Assistant (Forest Management),Lincoln University of Missouri (Private),"904 Chestnut Street (Jefferson City, Missouri)","$25,000 per year",between 8/1/2025 and 8/29/2025,01/09/2025,Graduate Opportunities
PhD or MS Opportunity: Landscape and Fire Ecology,University of Florida (State),"5988 Highway 90 (Milton, Florida)","starting at $30,000 per year",before 8/18/2025,01/08/2025,Graduate Opportunities
Graduate student candidate in microbial bioinformatics and environmental microbiology,University of Texas at Tyler (State),"3900 University Boulevard, Dept. Biology (Tyler, Texas)","$21,000 per year",between 8/15/2025 and 8/20/2025,01/07/2025,"Graduate Opportunities, Undergraduate Opportunities"
Graduate Research Assistantship (MS) Fisheries and Aquatic Ecology,Thomas Detmer (Private),"Ames, Iowa","starting at $27,000 per year",after 5/1/2025,01/06/2025,Graduate Opportunities
PhD Research/Teaching Assistantship in Human Dimensions of Wolf Management in Oregon,Oregon State University (State),"Corvallis, Oregon","$30,000 to $33,000 per year",after 9/1/2025,01/06/2025,Graduate Opportunities
PhD Assistantship: Spatial Ecology and Monitoring of a Reintroduced Elk Population,U.S. Geological Survey/West Virginia University (Federal),"Morgantown, West Virginia","$32,000 to $35,000 per year",before 8/20/2025,01/06/2025,Graduate Opportunities
